title,publisher,city,edition,1stedition,download,library,genre,cover,excerpt,repository,repurl,rep-2,author,author-nationality,author-born,author-death,author2,author2-nationality,author2-born,author2-death,author3,author3-nationality,author3-born,author3-death,lg
Tierra mojada,Universidad del Valle,Cali,2020, ,https://archive.org/download/antologia-mujeres-poetas-afrocolombianas_202109/Tierra%20mojada.pdf, , ,tierra-mojada-manuel-zapata.jpg,"—¿Y habrá tierra para mí?
—Para todo el mundo. Esa vaina no tiene dueño —respondió López, con aire de magnanimidad—. Todo el que tenga valor para amarrarse los pantalones con las dificultades puede echar ancla. Es bueno que lo hagan ahora no más, para aprovechar las lluvias que ya se vienen.
—Pues cuente conmigo. Dígame cuando se va para acompañarlo.",Biblioteca Virtual del Banco de la República,https://babel.banrepcultural.org/, ,Manuel Zapata Olivella,Colombia, ,,,,,,,,,, 
Um defeito de cor,Editora Record,Rio de Janeiro,2009, ,https://archive.org/download/autores-negros-seleccion/Ana_Maria_Goncalves_-_Um_Defeito_de_Cor.pdf, , ,um-defeito-de-cor.jpg,"Passou o resto da noite embalando a filha e o neto mortos, e a luz do dia a encontrou buscando água no rio para molhar e esfregar os dois corpos. Depois cavou o chão no lugar onde dormiam, enrolou cada corpo em uma esteira e os colocou dentro do buraco. Uma única cova rasa para os dois, que mal deu para abrigá-los e à terra que jogou por cima enquanto cantava, para em seguida se ajoelhar ao lado e rezar por horas e horas. No meio da tarde, reacendeu o fogo no quintal e fez comida, que dividiu em cinco partes iguais: uma para mim, uma para a Taiwo, uma para ela e duas para colocar ao lado da cova. Só então desenrolou sua esteira e dormiu, sem ter dito uma única palavra para mim ou para a Taiwo, sem ter chorado uma só lágrima a mais desde a partida dos guerreiros",Centro de Recursos de Computacionais,https://cercomp.ufg.br/, ,Ana Maria Gonçalves,Brasil, ,,,,,,,,,, 
Vivan los compañeros,Ministerio de Cultura,Bogotá,2010, ,https://ia601403.us.archive.org/34/items/antologia-mujeres-poetas-afrocolombianas_202109/Vivan%20los%20compa%C3%B1eros.pdf, , ,vivan-los-compañeros-carlos-arturo-truque.jpg,"Así, sabroso, regustando el ritmo picante desgranado por los guasás; así, moviéndose en círculos, como sobre un tambor; así, con la sangre corriente, llevándole bien lejos, hacia atrás, a donde ni memoria había.
Él allí, dándose su gusto, tirando de los compases como de una cuerda, diablo de negro mandinga, con la boca como brasa del patacoré «que se va caé», se iba sintiendo mejor. Y allá en la tiniebla, la Damiana con su aire y sus pulmones que no daban más, sorbiendo espeso, sacándoles un último lance a las manos para sus dos cununos flácidos, que apenas vibraron un postrer compás antes de quedarse en paz, privaditos, solo simples cueros, sin aire posible ni dolor probable.",Biblioteca Nacional de Colombia,https://catalogoenlinea.bibliotecanacional.gov.co/client/es_ES/default, ,Carlos Arturo Truque,Colombia, ,,,,,,,,,,
